<!ELEMENT travel (head,body)>
<!ELEMENT head (title,titleImg,date,author)>
<!ELEMENT title (#PCDATA)>
<!ELEMENT titleImg (#PCDATA)>
<!ELEMENT date (#PCDATA)>
<!ELEMENT author (#PCDATA)>

<!ELEMENT body (node*)>
<!ELEMENT node (text+|photo+)>
<!ELEMENT text (#PCDATA)>
<!ELEMENT photo (#PCDATA)>
